20210208,龙华区,龙华中心,鸿荣源・壹成中心第七区,http://sz.ke.com/ershoufang/105104744794.html,业主自住精装修小区花园好带泳池,650万,单价83548元/平米,低楼层(共52层)3室2厅,,77.8平米,
20210208,龙华区,龙华中心,美丽365花园,http://sz.ke.com/ershoufang/105104732577.html,满五年 无增值税！业主诚心卖 看小区花园,520万,单价66882元/平米,中楼层(共7层),3室1厅,77.75平米,
20210208,龙华区,龙华中心,保利悦都,http://sz.ke.com/ershoufang/105104728410.html,方正通风、视野开阔，商 业配套成熟，交通生活方便,966万,单价81273元/平米,高楼层(共27层),5室2厅,118.86平米,
20210208,龙华区,龙华中心,龙华花半里花园,http://sz.ke.com/ershoufang/105104727806.html,龙华花半里精装三房，满五年，高楼层必看好房,535万,单价68301元/平米,中楼层(共33层),3室1厅,78.33平米,
20210208,龙华区,龙华中心,丹枫雅苑,http://sz.ke.com/ershoufang/105104716986.html,龙华高楼层 南向的 户型采光很好 无暗房 产权清晰,500万,单价71215元/平米,中楼层(共24层),2室2厅,70.21平米,
20210208,龙华区,龙华中心,福景花园,http://sz.ke.com/ershoufang/105104705212.html,地铁口300米   2+1房 红本  税少,500万,单价70772元/平米,低楼层(共7层),3室2厅,70.65平米,
20210208,龙华区,龙华中心,天玑公馆,http://sz.ke.com/ershoufang/105104703985.html,请湖北地铁口业主诚意出售，看房方便，体验舒适三房,550万,单价66378元/平米,低楼层(共41层),3室2厅,82.86平米,
20210208,龙华区,龙华中心,鸿荣源・壹城中心第五区,http://sz.ke.com/ershoufang/105104700733.html,五区舒适三房   楼层位置佳   视野开阔,630万,单价85808元/平米,高楼层(共47层),3室2厅,73.42平米,
20210208,龙华区,龙华中心,龙华花半里花园,http://sz.ke.com/ershoufang/105104699513.html,龙华花半里4房，业主诚心出售，看房方便,620万,单价69663元/平米,高楼层(共33层),4室1厅,89平米,
20210208,龙华区,龙华中心,鸿荣源・壹成中心第七区,http://sz.ke.com/ershoufang/105104688910.html,装修价值百万  地*铁口物业   带名*校,1150万,单价92082元/平米,高楼层(共52层)5室2厅,,124.89平米,
20210208,龙华区,龙华中心,龙华花半里花园,http://sz.ke.com/ershoufang/105104685328.html,龙华花半里中楼层精装三房通风视野好必看好房,539万,单价67953元/平米,中楼层(共33层),3室2厅,79.32平米,
20210208,龙华区,龙华中心,龙华花半里花园,http://sz.ke.com/ershoufang/105104684716.html,龙华花半里满五唯一业主诚心出售,538万,单价68975元/平米,低楼层(共33层),3室1厅,78平米,
20210208,龙华区,龙华中心,龙华花半里花园,http://sz.ke.com/ershoufang/105104678507.html,龙华花半里满五唯一业主诚心出售,550万,单价64111元/平米,高楼层(共33层),3室1厅,85.79平米,
20210208,龙华区,龙华中心,幸福城一期,http://sz.ke.com/ershoufang/105104674144.html,此房业主诚心卖，户型通透，市场价格,850万,单价67686元/平米,低楼层(共29层),4室1厅,125.58平米,
20210208,龙华区,龙华中心,龙华花半里花园,http://sz.ke.com/ershoufang/105104673398.html,龙华花半里 精装三房 满五唯一 看房方便,550万,单价70091元/平米,高楼层(共33层),3室1厅,78.47平米,
20210208,龙华区,龙华中心,鸿荣源・壹城中心第九区,http://sz.ke.com/ershoufang/105104661872.html,壹城九区――东西通透采光视野好的自住四房,820万,单价92135元/平米,高楼层(共48层),4室2厅,89平米,
20210208,龙华区,龙华中心,优品建筑,http://sz.ke.com/ershoufang/105104651353.html,优品建筑  精装四房，位置安静看花园,920万,单价60309元/平米,中楼层(共11层),4室2厅,152.55平米,
20210208,龙华区,龙华中心,龙华花半里花园,http://sz.ke.com/ershoufang/105104647260.html,双龙抱珠三房户型，业主诚心出售，满五唯一，安静居家,539万,单价68750元/平米,低楼层(共33层),3室2厅,78.4平米,
20210208,龙华区,龙华中心,龙华花半里花园,http://sz.ke.com/ershoufang/105104643720.html,此房满五年唯一 ，业主诚心卖，中高楼层！朝东南！,700万,单价89286元/平米,中楼层(共33层),3室1厅,78.4平米,
20210208,龙华区,龙华中心,鸿荣源・壹城中心第九区,http://sz.ke.com/ershoufang/105104632194.html,优质户型，使用率高，满二中楼层,790万,单价89296元/平米,中楼层(共48层),4室2厅,88.47平米,
20210208,龙华区,龙华中心,鸿荣源・壹成中心第七区,http://sz.ke.com/ershoufang/105104622994.html,业主诚心出售，经典装修，视野开阔，采光通透,1200万,单价95916元/平米,低楼层(共52层)5室2厅,,125.11平米,
20210208,龙华区,龙华中心,幸福城商业大厦,http://sz.ke.com/ershoufang/105104616472.html,清湖地铁口精装好公寓，看房方便，业主好沟通,275万,单价54007元/平米,中楼层(共28层),1室1厅,50.92平米,
20210208,龙华区,龙华中心,天玑公馆,http://sz.ke.com/ershoufang/105104614876.html,满两年，次新房，无遮挡，采光通风好,560万,单价63385元/平米,低楼层(共41层),3室2厅,88.35平米,
20210208,龙华区,龙华中心,龙华花半里花园,http://sz.ke.com/ershoufang/105104613032.html,花半里居家精装四房 低层接地气 少有在卖,760万,单价89528元/平米,低楼层(共33层),4室2厅,84.89平米,
20210208,龙华区,龙华中心,龙华花半里花园,http://sz.ke.com/ershoufang/105104587843.html,龙华花半里 精装三房 东南厅出阳台 业主自住,550万,单价69797元/平米,中楼层(共33层),3室1厅,78.8平米,
20210208,龙华区,龙华中心,龙华花半里花园,http://sz.ke.com/ershoufang/105104576088.html,花半里精装四房 一手业主居家保养好 满五税费少,610万,单价71926元/平米,中楼层(共33层),4室2厅,84.81平米,
20210208,龙华区,龙华中心,锦绣御园,http://sz.ke.com/ershoufang/105104574558.html,双证大户型，满五红本，中间楼层，三面无遮挡采光,1080万,单价61017元/平米,中楼层(共32层),4室2厅,177平米,
20210208,龙华区,龙华中心,鸿荣源・壹城中心第九区,http://sz.ke.com/ershoufang/105104548976.html,壹成高档社区人文荟萃，高品质的象征，南北通透户型,1050万,单价81132元/平米,低楼层(共48层),5室1厅,129.42平米,
20210208,龙华区,龙华中心,江南华府,http://sz.ke.com/ershoufang/105104544858.html,ICO旁精装写字楼，业主诚心出售。,195万,单价31457元/平米,高楼层(共14层),1室0厅,61.99平米,
20210208,龙华区,龙华中心,新华苑,http://sz.ke.com/ershoufang/105104521887.html,此房满五唯一，户型方正，朝向，采光，通风都很好,645万,单价52525元/平米,高楼层(共8层),4室2厅,122.8平米,
20210208,龙华区,龙华中心,天玑公馆,http://sz.ke.com/ershoufang/105104513925.html,龙华清湖北地铁口 天玑公馆 全新社区 毛坯通透三房,548万,单价62132元/平米,高楼层(共41层),3室2厅,88.2平米,
20210208,龙华区,龙华中心,天玑公馆,http://sz.ke.com/ershoufang/105104510296.html,离梦想近，实现舒适3房，体验奢华生活，有图有真相,560万,单价62837元/平米,低楼层(共41层),3室2厅,89.12平米,
20210208,龙华区,龙华中心,保利悦都,http://sz.ke.com/ershoufang/105104487322.html,保利悦都 2室2厅 西南,500万,单价73573元/平米,中楼层(共27层),2室2厅,67.96平米,
20210208,龙华区,龙华中心,幸福城商业大厦,http://sz.ke.com/ershoufang/105104486594.html,幸福城商业大厦 1室1厅 东南,280万,单价54978元/平米,低楼层(共28层),1室1厅,50.93平米,
20210208,龙华区,龙华中心,天玑公馆,http://sz.ke.com/ershoufang/105104471856.html,非限购，巧妙空间，实用2房、清湖北站，70年产权,175万,单价48558元/平米,高楼层(共20层),2室1厅,36.04平米,
20210208,龙华区,龙华中心,龙华花半里花园,http://sz.ke.com/ershoufang/105104466812.html,龙华花半里花园 4室1厅 北,698万,单价76561元/平米,高楼层(共33层),4室1厅,91.17平米,
20210208,龙华区,龙华中心,天玑公馆,http://sz.ke.com/ershoufang/105104463958.html,通透户型、大视野、4号延长线请湖北,570万,单价65225元/平米,高楼层(共41层),3室2厅,87.39平米,
20210208,龙华区,龙华中心,弘诚阁,http://sz.ke.com/ershoufang/105104462463.html,满五年税费低，中楼层看花花园，业主诚心出售,510万,单价58353元/平米,中楼层(共7层),4室2厅,87.4平米,
20210208,龙华区,龙华中心,天玑公馆,http://sz.ke.com/ershoufang/105104457085.html,此房满两年唯一，户型方正视野采光好，交通便利,560万,单价63385元/平米,中楼层(共41层),3室2厅,88.35平米,
20210208,龙华区,龙华中心,天玑公馆,http://sz.ke.com/ershoufang/105104442200.html,请湖北:天玑公馆，毛坯3房，实用户型，配套成熟,530万,单价63964元/平米,低楼层(共41层),3室2厅,82.86平米,
20210208,龙华区,龙华中心,鸿荣源・壹城中心第五区,http://sz.ke.com/ershoufang/105104416752.html,高层 南北通风好 采光佳 居住舒适,700万,单价79016元/平米,高楼层(共47层),4室1厅,88.59平米,
20210208,龙华区,龙华中心,龙华花半里花园,http://sz.ke.com/ershoufang/105104410611.html,龙华花半里精装三房满五唯一免个税费少红本在手,600万,单价67928元/平米,低楼层(共33层),3室1厅,88.33平米,
20210208,龙华区,龙华中心,玉华花园,http://sz.ke.com/ershoufang/105104406615.html,精装大两房，满五唯一无抵押，正南向看花园,480万,单价57972元/平米,中楼层(共9层),2室2厅,82.8平米,
20210208,龙华区,龙华中心,香缇雅苑,http://sz.ke.com/ershoufang/105104397644.html,户型是标准一房，紧凑而实用，使用率高,196万,单价64944元/平米,高楼层(共18层),1室1厅,30.18平米,
20210208,龙华区,龙华中心,鸿荣源・壹成中心第六区,http://sz.ke.com/ershoufang/105104359601.html,高楼层！大五房！南北通！自住精装！即买即住！,1083万,单价84045元/平米,低楼层(共50层),5室2厅,128.86平米,
20210208,龙华区,龙华中心,华源大厦,http://sz.ke.com/ershoufang/105104317816.html,龙华地铁口大三房    业主诚心卖 有钥匙看房方便,550万,单价59486元/平米,中楼层(共8层)3室2厅,,92.46平米,
20210208,龙华区,龙华中心,天玑公馆,http://sz.ke.com/ershoufang/105104305829.html,天机公馆  户型实用 次新房.,560万,单价63637元/平米,高楼层(共41层),3室2厅,88平米,
20210208,龙华区,龙华中心,龙华花半里花园,http://sz.ke.com/ershoufang/105104299280.html,地铁口花半里比较少的户型，满五年唯一欠款少，税费少,555万,单价70683元/平米,高楼层(共33层),3室2厅,78.52平米,
20210208,龙华区,龙华中心,鸿荣源・壹城中心第九区,http://sz.ke.com/ershoufang/105104289812.html,高楼层！大五房！南北通！可以自由发挥想象空间,1138万,单价87911元/平米,低楼层(共48层),5室1厅,129.45平米,
20210208,龙华区,龙华中心,鸿荣源・壹城中心第五区,http://sz.ke.com/ershoufang/105104289610.html,采光好，交通便利，配套设施齐全,680万,单价77326元/平米,低楼层(共47层),3室2厅,87.94平米,
20210208,龙华区,龙华中心,鸿荣源・壹城中心第五区,http://sz.ke.com/ershoufang/105104265351.html,高使用 正规四房 红本在手 高楼层 视野开阔,700万,单价79016元/平米,高楼层(共48层),4室2厅,88.59平米,
20210208,龙华区,龙华中心,天玑公馆,http://sz.ke.com/ershoufang/105104254466.html,清湖北地铁口物业 全新清水房 厅出阳台 随意改造,550万,单价62500元/平米,高楼层(共41层),3室2厅,88平米,
20210208,龙华区,龙华中心,鸿荣源・壹成中心第六区,http://sz.ke.com/ershoufang/105104253165.html,此房是正规4房、高楼层，视野开阔，满两年户型通透,735万,单价82317元/平米,高楼层(共50层),4室2厅,89.29平米,
20210208,龙华区,龙华中心,天玑公馆,http://sz.ke.com/ershoufang/105104243311.html,通透户型、大视野、4号延长线请湖北,550万,单价62246元/平米,中楼层(共41层),3室2厅,88.36平米,
20210208,龙华区,龙华中心,鸿荣源・壹成中心第六区,http://sz.ke.com/ershoufang/105104241954.html,房子精装修 可拎包入住                  .,780万,单价87641元/平米,低楼层(共44层),4室2厅,89平米,
20210208,龙华区,龙华中心,悠山美地,http://sz.ke.com/ershoufang/105104223269.html,六号线地铁 满五年唯一 山景阔绰房,720万,单价84796元/平米,中楼层(共29层),3室2厅,84.91平米,
20210208,龙华区,龙华中心,龙华花半里花园,http://sz.ke.com/ershoufang/105104222476.html,花半里经典三房 两卫改一卫 一手业主可免个税,550万,单价62359元/平米,低楼层(共33层),3室2厅,88.2平米,
20210208,龙华区,龙华中心,鸿荣源・壹成中心第七区,http://sz.ke.com/ershoufang/105104221595.html,鸿荣源・壹成中心第七区 4室2厅 东南,765万,单价85956元/平米,中楼层(共54层),4室2厅,89平米,
20210208,龙华区,龙华中心,龙华花半里花园,http://sz.ke.com/ershoufang/105104211113.html,花半里 居家精装三房 买来直接拎包入住,648万,单价80258元/平米,中楼层(共33层),3室1厅,80.74平米,
20210208,龙华区,龙华中心,丹枫雅苑,http://sz.ke.com/ershoufang/105104197930.html,丹枫雅苑正规高楼层正规两房视野开阔,445万,单价77743元/平米,高楼层(共24层),2室2厅,57.24平米,
20210208,龙华区,龙华中心,鸿荣源・壹成中心第六区,http://sz.ke.com/ershoufang/105104190979.html,看花园好房，楼层好，视野宽阔，采光充足。,700万,单价92446元/平米,低楼层(共44层),3室2厅,75.72平米,
20210208,龙华区,龙华中心,鸿荣源・壹成中心第六区,http://sz.ke.com/ershoufang/105104181570.html,鸿荣源壹成六区 五房 满二 通透户型,1100万,单价85232元/平米,中楼层(共50层),5室2厅,129.06平米,
20210208,龙华区,龙华中心,鸿荣源・壹成中心第六区,http://sz.ke.com/ershoufang/105104166658.html,龙华  壹城正规景观四房业主诚心卖,768万,单价86575元/平米,中楼层(共52层),4室2厅,88.71平米,
20210208,龙华区,龙华中心,青年城邦园,http://sz.ke.com/ershoufang/105104139983.html,龙华地铁口精装两房，东南看花园位置安静，方便看房！,450万,单价77640元/平米,高楼层(共13层),2室2厅,57.96平米,
20210208,龙华区,龙华中心,鸿荣源・壹城中心第五区,http://sz.ke.com/ershoufang/105104136455.html,朝南采光通风,不错，户型方正 无遮挡,690万,单价79760元/平米,低楼层(共47层),4室2厅,86.51平米,
20210208,龙华区,龙华中心,龙华花半里花园,http://sz.ke.com/ershoufang/105104117914.html,花半里三房 满五年唯一 自己保养好,700万,单价88184元/平米,中楼层(共33层),3室1厅,79.38平米,
20210208,龙华区,龙华中心,鸿荣源・壹成中心第六区,http://sz.ke.com/ershoufang/105104110935.html,业主诚心卖房，价格有优惠，看房有惊喜,1150万,单价89550元/平米,高楼层(共46层),5室2厅,128.42平米,
20210208,龙华区,龙华中心,保利悦都,http://sz.ke.com/ershoufang/105104107071.html,清湖地铁口保利悦都花园 全新精装修两居室 刚需实用,554万,单价80186元/平米,高楼层(共27层),2室2厅,69.09平米,
20210208,龙华区,龙华中心,鸿荣源・壹成中心第六区,http://sz.ke.com/ershoufang/105104087648.html,此房满2年，通透格局，采光好，配套设施齐全交通便利,730万,单价84403元/平米,低楼层(共52层),4室2厅,86.49平米,
20210208,龙华区,龙华中心,天玑公馆,http://sz.ke.com/ershoufang/105104023013.html,天玑公馆3房2厅2卫看花园 实用户型,580万,单价65910元/平米,中楼层(共41层),3室2厅,88平米,
20210208,龙华区,龙华中心,鸿荣源・壹城中心第五区,http://sz.ke.com/ershoufang/105103974442.html,中间楼层，户型方正，采光通风，看房方便,610万,单价81759元/平米,中楼层(共47层),3室2厅,74.61平米,
20210208,龙华区,龙华中心,鸿荣源・壹成中心第六区,http://sz.ke.com/ershoufang/105103947092.html,壹城  居家好房 四房两卫 诚意卖,800万,单价89316元/平米,低楼层(共50层),4室2厅,89.57平米,
20210208,龙华区,龙华中心,鸿荣源・壹城中心第九区,http://sz.ke.com/ershoufang/105103943096.html,壹成标准方正优质五房，视野阳光充足,915万,单价88278元/平米,低楼层(共45层),5室2厅,103.65平米,
20210208,龙华区,龙华中心,香缇雅苑,http://sz.ke.com/ershoufang/105103939310.html,房子位置安静，看花园，带大露台的,510万,单价59552元/平米,低楼层(共7层),3室2厅,85.64平米,
20210208,龙华区,龙华中心,鸿荣源・壹城中心第五区,http://sz.ke.com/ershoufang/105103926954.html,真精装修满两年，无增值税，中间楼层，采光足，配套齐,600万,单价81722元/平米,高楼层(共47层),3室2厅,73.42平米,
20210208,龙华区,龙华中心,鸿荣源・壹成中心第六区,http://sz.ke.com/ershoufang/105103917081.html,鸿荣源 壹成 高楼层 通透4房在售,730万,单价82421元/平米,高楼层(共44层),4室2厅,88.57平米,
20210208,龙华区,龙华中心,龙华花半里花园,http://sz.ke.com/ershoufang/105103898864.html,花半里标准三房  满五年欠款少，精装修东南向视野好,550万,单价68315元/平米,低楼层(共33层),3室1厅,80.51平米,
20210208,龙华区,龙华中心,鸿荣源・壹城中心第九区,http://sz.ke.com/ershoufang/105103871766.html,龙华壹成九区精装三房强势来袭业主诚心出售,658万,单价79402元/平米,低楼层(共45层),3室2厅,82.87平米,
20210208,龙华区,龙华中心,鸿荣源・壹成中心第六区,http://sz.ke.com/ershoufang/105103851943.html,壹城三房出售,商.业配套完善 龙华地铁口 真实房源,666万,单价85418元/平米,高楼层(共46层),3室1厅,77.97平米,
20210208,龙华区,龙华中心,鸿荣源・壹成中心第七区,http://sz.ke.com/ershoufang/105103850732.html,鸿荣源龙华壹成第七区，小区环境安静舒适密度低,1200万,单价94802元/平米,高楼层(共52层)5室2厅,,126.58平米,
20210208,龙华区,龙华中心,鸿荣源・壹城中心第九区,http://sz.ke.com/ershoufang/105103848162.html,房产证已经满5年了，税费少毛坯清水房 ，红本在手,688万,单价83102元/平米,低楼层(共46层),3室1厅,82.79平米,
20210208,龙华区,龙华中心,鸿荣源・壹城中心第九区,http://sz.ke.com/ershoufang/105103838172.html,满五红本无增值税！不用赎楼！业主诚心卖 价格有空间必看好房,688万,单价83032元/平米,低楼层(共46层),3室2厅,82.86平米,
20210208,龙华区,龙华中心,鸿荣源・壹城中心第九区,http://sz.ke.com/ershoufang/105103806224.html,房子满2年，普通住宅，税费少。 诚心出售，,740万,单价88996元/平米,高楼层(共45层),3室2厅,83.15平米,
20210208,龙华区,龙华中心,富驰大厦,http://sz.ke.com/ershoufang/105103803939.html,交通便利，出租人群多，不受住宅政策限购,180万,单价45000元/平米,中楼层(共24层),1室0厅,40平米,
20210208,龙华区,龙华中心,悠山美地,http://sz.ke.com/ershoufang/105103786997.html,6号线地铁口 羊台山东站  冬暖夏凉3房 看羊台山景,650万,单价74320元/平米,高楼层(共22层),3室2厅,87.46平米,
20210208,龙华区,龙华中心,鸿荣源・壹城中心第九区,http://sz.ke.com/ershoufang/105103746223.html,壹城大社区 78平3房 东看花园 红本在手,688万,单价88398元/平米,低楼层(共46层),3室1厅,77.83平米,
20210208,龙华区,龙华中心,美丽365花园,http://sz.ke.com/ershoufang/105103711617.html,清湖地铁 园林小区 看泳池 安静位置,550万,单价55028元/平米,中楼层(共9层),3室1厅,99.95平米,
20210208,龙华区,龙华中心,保利悦都,http://sz.ke.com/ershoufang/105103576477.html,清湖地铁口保利悦都 三房两卫毛坯房 小区配套成熟,675万,单价75886元/平米,中楼层(共27层),3室2厅,88.95平米,
20210208,龙华区,龙华中心,鸿荣源・壹城中心第五区,http://sz.ke.com/ershoufang/105103549090.html,壹城高层三房，位置安静，东南向。,700万,单价95342元/平米,低楼层(共48层),3室2厅,73.42平米,
20210208,龙华区,龙华中心,龙华花半里花园,http://sz.ke.com/ershoufang/105103544453.html,精装修三房  东南向高层视野好 满五唯一税少,730万,单价84963元/平米,高楼层(共33层),3室1厅,85.92平米,
20210208,龙华区,龙华中心,桂冠华庭,http://sz.ke.com/ershoufang/105103536080.html,6号线正地铁口4房 冬暖夏凉居家舒适 近羊台山,580万,单价52632元/平米,中楼层(共17层),3室2厅,110.2平米,
20210208,龙华区,龙华中心,鸿荣源・壹城中心第五区,http://sz.ke.com/ershoufang/105103517220.html,五区4房 精装修  拎包入住  楼层适中必看好房,700万,单价78776元/平米,高楼层(共47层),4室2厅,88.86平米,
20210208,龙华区,龙华中心,新阳丽舍,http://sz.ke.com/ershoufang/105103509384.html,新阳丽舍精装一房，看房方便。。。,220万,单价57040元/平米,中楼层(共7层),1室1厅,38.57平米,
20210208,龙华区,龙华中心,鸿荣源・壹城中心第九区,http://sz.ke.com/ershoufang/105103394724.html,龙华地铁站旁壹方天地楼上朝南小三房,749万,单价90263元/平米,中楼层(共46层),3室2厅,82.98平米,
20210208,龙华区,龙华中心,鸿荣源・壹成中心第六区,http://sz.ke.com/ershoufang/105103376687.html,壹城六区，朝南向位置安静三房，正看花园全景,660万,单价87696元/平米,低楼层(共52层),3室2厅,75.26平米,
20210208,龙华区,龙华中心,鸿荣源・壹城中心第五区,http://sz.ke.com/ershoufang/105103362081.html,此房户型方正.采光通风效果好,鸿荣源的物业必看好房,580万,单价77728元/平米,低楼层(共48层),3室2厅,74.62平米,
20210208,龙华区,龙华中心,鸿荣源・壹成中心第七区,http://sz.ke.com/ershoufang/105103338343.html,此房少欠款，税费低，好楼层看房方便,715万,单价80175元/平米,高楼层(共54层)4室2厅,,89.18平米,
20210208,龙华区,龙华中心,幸福城商业大厦,http://sz.ke.com/ershoufang/105103331838.html,精装修，品牌家私电齐全，可拎包住，也可直接出租,290万,单价53834元/平米,中楼层(共28层),1室1厅,53.87平米,
20210208,龙华区,龙华中心,合能城市阳光花园,http://sz.ke.com/ershoufang/105103264693.html,龙华合能城市阳光正规两房 精装修 电梯房 诚心出售必看好房,320万,单价47499元/平米,中楼层(共22层),2室1厅,67.37平米,
20210208,龙华区,龙华中心,美丽AAA花园,http://sz.ke.com/ershoufang/105103235490.html,美丽AAA  精装二房  业主自住  装修保养好,535万,单价66091元/平米,高楼层(共18层),2室1厅,80.95平米,
20210208,龙华区,龙华中心,鸿荣源・壹城中心第五区,http://sz.ke.com/ershoufang/105103214836.html,业主精装修三房！视野很开阔 ，通风采光,660万,单价89894元/平米,中楼层(共48层),3室2厅,73.42平米,
20210208,龙华区,龙华中心,鸿荣源・壹城中心第九区,http://sz.ke.com/ershoufang/105103213884.html,业主急售 鸿荣源 壹成九区*大靓房 看房方便,1150万,单价87122元/平米,中楼层(共48层),5室1厅,132平米,
20210208,龙华区,龙华中心,鸿荣源・壹城中心第九区,http://sz.ke.com/ershoufang/105103135620.html,鸿荣源・壹城中心第九区 5室2厅 北,900万,单价94947元/平米,低楼层(共46层),5室2厅,94.79平米,
20210208,龙华区,龙华中心,鸿荣源・壹成中心第七区,http://sz.ke.com/ershoufang/105103132866.html,业主诚心出售，位置安静,出行,购物都很方便,700万,单价89744元/平米,低楼层(共52层)3室2厅,,78平米,
20210208,龙华区,龙华中心,幸福城公寓,http://sz.ke.com/ershoufang/105103101346.html,幸福城公寓 2室2厅 东,390万,单价50000元/平米,中楼层(共28层),2室2厅,78平米,
20210208,龙华区,龙华中心,鸿荣源・壹成中心第七区,http://sz.ke.com/ershoufang/105103062082.html,此房是壹城七区标准4房，经典户型,800万,单价89848元/平米,中楼层(共54层),4室1厅,89.04平米,
20210208,龙华区,龙华中心,鸿荣源・壹城中心第九区,http://sz.ke.com/ershoufang/105102979284.html,满五年红本在手！无增值税无赎楼费！业主诚心卖 ！,788万,单价92035元/平米,低楼层(共49层),4室2厅,85.62平米,
20210208,龙华区,龙华中心,保利悦都,http://sz.ke.com/ershoufang/105102866916.html,清湖地铁口 保利悦都花园 经典三房两卫，配套完善,700万,单价78758元/平米,低楼层(共27层),3室2厅,88.88平米,
20210208,龙华区,龙华中心,鸿荣源・壹成中心第七区,http://sz.ke.com/ershoufang/105102855832.html,壹城高品质4房，随时可以看房，节约时间,730万,单价83324元/平米,低楼层(共54层),4室2厅,87.61平米,
20210208,龙华区,龙华中心,富驰大厦,http://sz.ke.com/ershoufang/105102757986.html,交通便利，拎包就可以住，户型方正 ，业主急售，,160万,单价40333元/平米,高楼层(共24层),1室0厅,39.67平米,
20210208,龙华区,龙华中心,丹枫雅苑,http://sz.ke.com/ershoufang/105102700420.html,龙华电梯2房 满五唯一 少量欠款 急卖,530万,单价75542元/平米,低楼层(共24层),2室2厅,70.16平米,
20210208,龙华区,龙华中心,丹枫雅苑,http://sz.ke.com/ershoufang/105102572630.html,房子满五唯一  经典2+1 户型 诚心卖 。,540万,单价75737元/平米,低楼层(共24层),2室1厅,71.3平米,
